IdPA,IdRapp,DifferenceUploadDay,NomUnite,NomPrestataire,NomAuditeurDB,TotalAuditeur,EXIGENCES,DCOTES,CONSTATSDAUDIT,ACTIONFOURNISSEUR,DELAI,AVISAUDITEUR,AUDITEURPA
552,552.0,8,VP Fournisseur 387,Visi office 4,VP Auditeur 5,449,"résultats du test de traçabilité réalisé (éléments amont et aval retracés, délai…)",b,"* test réalisé sur maxi burger x2 monoprix fabriqué le 24/07 soit lot 205 ligne1 de 11h08 à 12h30 commentaires : l'expression du lot dans trace one est différente et mal formalisée avec une confusion ligne/conditionneuse. sur l'emballage, ne figure que le n° de conditionneuse, ce qui est suffisant car la ligne est toujours l2. * dlc 22/09, soit 60 jours * 7 palettes complètes de 104 plateaux de 9 uvci chacun * identification de toutes les mp mises en œuvre, des lots, des contrôles à réception commentaires : l'origine du sésame (guatemala) diffère de celle mentionné (nicaragua) * contrôles de production réalisés et conformes * poids net : 175,79g avec 6,48g d'écart type * expédition chez ffv le 28/07. conformité de réception chez ffv. l'identification de tous les produits expédiés de la plateforme ffv vers monoprix. 230 colis sont encore en stock * echantillothèque : présente","mise à jour de la procédure de traçabilité afin de mieux préciser les informations aux différents niveaux (séparation et précision des lignes de fabrication, des lignes de conditionnement et des lignes d’étiquetage des palettes). l’expression du lot sur les sachets flowpack a toujours été : - quantième de production (a+qqq) - heure d’emballage - n° emballeuse (ligne de production non-nécessaire car obligatoirement l2) - dluo ffv: n° de lot => nous allons demander à modifier l'expression du n° de lot qui est erronée dans l'onglet etiquetage du cdc (mais qui est correct dans l'onglet traçabilité). origine sésame => nous allons demander à modifier cette information dans le cdc.",EBF: fait / FFV: 30/09/2017,approuvé,VP Auditeur 5
553,553.0,8,VP Fournisseur 387,Visi office 4,VP Auditeur 5,449,etat des locaux de production,b,commentaires : mauvaise récupération de l'eau pulvérisée sur les pains avant la dépose du sésame occasionnant une stagnation d'eau autour de la ligne,"l'eau stagnante observée sur la ligne 1, ligne ne produisant pas pour monoprix, n'est pas liée à la pulvérisation sur les pains mais à un mauvais raclage après nettoyage. rappel des consignes au personnel de sanitation.",fait,approuvé,VP Auditeur 5
554,554.0,8,VP Fournisseur 387,Visi office 4,VP Auditeur 5,449,matériels de nettoyage,b,"commentaires : l'état des filtres du gros aspirateur utilisé dans la salle de conditionnement flow pack n'est pas suivi avec un risque, en cas de détérioration, de contribuer à la contamination du local, lors des opérations destinées à son entretien",le descriptif technique de l'aspirateur indique que le filtre doit être changé annuellement. l'aspirateur reste dans l'atelier lors des traitements de fumigation hebdomadaires. ce traitement de fumigation est un traitement de désinfection des surfaces et de l'air. le filtre est inspecte et nettoyé chaque mois par le service sanitation. le changement du filtre sera réalisé annuellement par la société fournisseur : nilfisk.,fait,approuvé,VP Auditeur 5
556,556.0,8,VP Fournisseur 387,Visi office 4,VP Auditeur 5,449,traçabilité,b,"commentaires : les pendules murales utilisées pour noter les heures des contrôles (et pour bloquer en conséquence les palettes nc) ne sont pas synchronisées avec celles du marquage des sachets ni avec celles des cartons. ces 2 dernières ne le sont pas non plus entre elles avec des différences qui ne sont pas surveillées et qui correspondaient à plusieurs minutes lors de l'audit. cette situation crée un risque de ne pas récupérer, en cas de retrait/rappel, les bons produits",notre procédure de gestion des non-conformes prévoit une marge de 10 minutes en cas de blocage de produit ce qui réduit le risque lié au décalage des pendules murales (quelques minutes de décalage). nous remplaçons les pendules murales par des horloges connectées comme sur nos autres lignes de production,Novembre 2017,approuvé,VP Auditeur 5
698,698.0,1,VP Fournisseur 390,Visi office 4,VP Auditeur 5,449,respect du plan de contrôle sur les matières premières,b,le plan de contrôle est respecté (contrôle fait par le réceptionnaire et par la qualité lorsque des résultats d'analyses sont prévus) nc. le cahier des charges trace one note pour le praliné noisette pour le critère aflatoxines : analyse ou attestation du fournisseur pour chaque livraison. il s'agit en fait d'un engagement à fournir des produits conformes à la réglementation. l'entreprise ne sait pas s'il existe ou non une analyse conforme à la clé,modification du cahier des charges et changement dans les termes utilisés.,15/09/2017,approuvé,VP Auditeur 5
701,701.0,1,VP Fournisseur 390,Visi office 4,VP Auditeur 5,449,"etalonnage légal annuel de la balance de contrôle des produits finis et contrôles intermédiaires internes au moins mensuels. dans le cas où les balances sont utilisées pour le contrôle individuel du dosage des produits, la balance doit être contrôlée quotidiennement.",c,"l'entreprise dispose de plusieurs balances ipfna en métrologie légale pour la réalisation des contrôles de masse des préemballages. nc. la balance utilisée pour le contrôle du lot testé en traçabilité n'était pas adaptée : échelon de 1g alors que le produit faisait 160g (ce qui requiert un échelon de 0,5g). de telles balances existent dans l'entreprise nc. les balances font l'objet d'un contrôle périodique hebdomadaire et non quotidien",sensibiliser le personnel à l'utilisation des balances adéquates. acheter de nouvelles balances. modifier la fiche spécifique pour donner l'information du contrôle quotidien de la balance situé en fin de ligne de conditionnement. modifier la feuille d'enregistrement du contrôle des balances en supprimant l'information des semaines.,31/10/2017,approuvé,VP Auditeur 5
702,702.0,1,VP Fournisseur 390,Visi office 4,VP Auditeur 5,449,contrôle de poids des produits finis : pertinence des règles d'échantillonnage et conformité des résultats.,d,"en fonction de l'effectif des lots fabriqués, le nombre de prélèvements est défini. la conformité des lots établie sur la moyenne des contrôles de l'échantillon. nc. le mode opératoire ne permet pas de statuer sur la conformité au regard du nombre de défectueux sur le lot fabriqué (ni sur l'échantillon testé) nc. l'entreprise utilise une tare (toujours la même). il n'y a pas de plan de surveillance pour identifier la variabilité sur ces tares.",supprimer toutes les tares déjà pré-faites. (les tares pré-existantes ont toutes été jetées). fabriquer une tare à chaque lancement de la ligne de conditionnement. (une tare pour contrôler le poids net en fin de ligne de conditionnement est fabriquée à chaque lancement de la ligne de conditionnement). etudier la possibilité d'interdire les poids défectueux. se renseigner sur des logiciels de gestion des contrôles des pré-emballés.//(ancienne action 10/10/2017 ) supprimer toutes les tares déjà pré-faites. fabriquer une tare à chaque lancement de la ligne de conditionnement. etudier la possibilité d'interdire les poids défectueux. se renseigner sur des logiciels de gestion des contrôles des pré-emballés.,31/03/2018,en attente d'élements complémentaires,VP Auditeur 5
703,703.0,1,VP Fournisseur 390,Visi office 4,VP Auditeur 5,449,"présence d'un registre des éléments en verre et plastique dur, avec détail des emplacements. le registre doit être inspecté au moins une fois par mois dans les zones des produits nus. si des éléments à risque immédiat sont situés au dessus du passage des produits nus, ils doivent être inspectés avant chaque démarrage de fabrication.",b,les risques de ce dans les ateliers à proximité des produits font l'objet dans tous les ateliers d'une surveillance au démarrage nc. tout le matériel cassable est répertorié et les vérifications ne sont faites par le sq qu'une fois par trimestre,"refondre l'inspection verre et plastique dur. certaines parties seront contrôler une fois par mois, d'autres tous les trimestres. refondre les contrôles de démarrage effectués par les opérateurs.//(ancienne action 10/10/2017 ) diviser l'inspection verre et plastique dur en deux parties. effectuer l'inspection des zones en contact des produits nus une fois par mois.",31/03/2018,en attente d'élements complémentaires,VP Auditeur 5
705,705.0,1,VP Fournisseur 390,Visi office 4,VP Auditeur 5,449,recette,d,"le cahier des charges trace one prévoit la possibilité de réincorporation des recyclages à hauteur de 25% au plus. lorsque du recyclage est fait, la traçabilité est assurée (vu test de traçabilité) nc. les instructions n'ont pas pris en compte que les recyclages pouvaient être à l'origine de nc sur la liste des ingrédients, voire sur celle d'allergènes. les conditions : liste des produits qui peuvent être recyclés dans les produits monoprix doivent figurer sur une liste positive","chiffrer la quantité de recyclages issus des étapes suivant l'enrobage. les instructions prennent en compte le risque allergène. nous étiquetons systématiquement les allergènes soja, fruits à coque, gluten et lait sur l'ensemble de nos emballages. les produits contenant de l'œuf et des sulfites n'entrent pas dans la composition des intérieurs de bonbons de chocolat et ne sont donc pas concernés par ces méthodes de recyclage. une cotation des implications financière est en cours pour notre direction.",30/09/2017,en attente d'élements complémentaires,VP Auditeur 5
706,706.0,1,VP Fournisseur 390,Visi office 4,VP Auditeur 5,449,traçabilité descendante,b,"les recyclages sont jetés 1 fois par an de façon à ne pas ""trainer"" à l'infini une matière première. nc. cependant, l'entreprise n'a pas défini, dans le cas ou un rappel serait nécessaire, le nombre raisonnable de dilutions qui devrait être pris en compte",définir un nombre raisonnable de dilution qui peuvent être pris en compte dans le cas d'un rappel.,31/03/2018,approuvé,VP Auditeur 5
707,707.0,1,VP Fournisseur 390,Visi office 4,VP Auditeur 5,449,flux,b,"exigüité de la structure avec fort encombrement dans les couloirs, les salles de conditionnement (pas de problèmes de moisissures cependant) les règles appliquées aux visiteurs sont satisfaisantes nc. règles non appliquées aux chauffeurs qui interviennent sur les quais avec leurs chaussures de ville (risque d'introduction de souillures)",demander aux chauffeurs de vêtir des surchaussures à leur entrée dans l'entreprise.,15/09/2017,en attente d'élements complémentaires,VP Auditeur 5
708,708.0,1,VP Fournisseur 390,Visi office 4,VP Auditeur 5,449,matières premières,b,"nc. pour les produits livrés en sac sur palette bois, il n'y a pas d'exigence de présence d'intercalaire entre palette et sac pour limiter les risques d'esquilles de bois",lister les produits concernés. nous souhaitons connaître les fournisseurs concernés afin de définir les possibilités d'action.,30/10/2017,en attente d'élements complémentaires,VP Auditeur 5
710,710.0,1,VP Fournisseur 390,Visi office 4,VP Auditeur 5,449,dégustations,b,dégustations faites par les responsables de production et la qualité nc. pas de formation ou de qualification de ces personnes à la dégustation pour les sensibiliser sur les biais possibles,former le personnel à la dégustation.,31/12/2017,approuvé,VP Auditeur 5
301,301.0,4,VP Fournisseur 401,Visi office 4,VP Auditeur 5,449,"correspondance des spécifications des matières premières avec le cdc monoprix (fournisseurs, origines, nature, attestations non allergènes, non ogm, non ionisées)",c,"* pour la plupart des ingrédients, les spécifications sont complètes. * nc. ce n'est pas le cas pour 2 ingrédients : lactate de potassium et chlorure de potassium pour lesquels les attestations sur les statuts au regard des allergènes, des ogm et de l'ionisation manquent *nc. il n'y a pas de cahier des charge signé avec les fournisseurs de poitrines ue * spécifications complètes pour les 2 emballages primaires * nc. mention d'aligal 15 dans le cahier des charges trace one alors que le site fabrique son mélange gazeux (sur les mêmes bases 50% n² et 50% co²)",- demande attestation aux fournisseurs (pontivy) - envoi cdc aux fournisseurs (pontivy) - modifier l'appellation dans trace one. ( service qualité saint-méen),30/9/17,en attente d'élements complémentaires,VP Auditeur 5
302,302.0,4,VP Fournisseur 401,Visi office 4,VP Auditeur 5,449,respect du plan de contrôle sur les matières premières,b,"* contrôle systématique température, aspect, mg et délais en réception. * plan de contrôle microbiologique régulier (résultats non vus) * nc. contrôle des films supérieurs : contrôle réalié par la rq à chaque réception, sans enregistrement (contrairement à ce qui est noté dans le cahier des charges)",contrôle effectué par la service achats de pontivy : un contrôle fait sur la première livraison. puis le service achats fera un contrôle sur la première livraison de l'année. contrôle visuel fait par le service qualité de saint-méen avec mise en place d'enregistrement.,30/8/17,approuvé,VP Auditeur 5
303,303.0,4,VP Fournisseur 401,Visi office 4,VP Auditeur 5,449,prise en compte et respect des allégations (si recette concernée),d,* lardons de qualité supérieure * nc. grande majorité de résultats sur monoprix et ranou (identique en formulation) non conformes sur l'hpd (> 74 ). problème bien identifié. plan d'action pas encore en place,"l'hpd est autour de 74.5%. un plan d'action est prévu de octobre à décembre pour modifier les recettes (saumurage, étuvage). intervention du fabricant du four contijet jv la française pour optimiser l'étuvage.//(ancienne action 05/10/2017 ) l'hpd est autour de 74.5%. un plan d'action est prévu de septembre à décembre pour modifier les recettes (saumurage, étuvage). intervention du fabricant du four contijet jv la française pour optimiser l'étuvage.//(ancienne action 28/07/2017 ) l'hpd est autour de 74.5%. un plan d'action est prévu de septembre à décembre pour modifier les recettes (saumurage, étuvage).",décembre 2017,en attente d'élements complémentaires,VP Auditeur 5
304,304.0,4,VP Fournisseur 401,Visi office 4,VP Auditeur 5,449,maîtrise de l'homogénéité des productions : observations techniques sur ligne et dégustation des produits à des dates différentes.,d,* nc. production de lardons faite avec les poitrines étuvées mais également avec les morceaux trop petits pour être accrochés et qui ne sont donc pas étuvés,les lardons monoprix sont fabriqués avec des poitrines entières. les morceaux de poitrine sont recyclées dans d'autres références. //(ancienne action 28/07/2017 ) les lardons monoprix sont fabriqués avec des poitrines entières. les chutes (petits morceaux) de poitrine sont recyclées dans d'autres références.,-,en attente d'élements complémentaires,VP Auditeur 5
305,305.0,4,VP Fournisseur 401,Visi office 4,VP Auditeur 5,449,coordonnées de gestion des alertes monoprix à jour et disponibles facilement,c,* les éléments sont disponibles au sq. * nc. la mise à disposition des informations et la méthodologie que doit appliquer le gardien les dimanches et les jours fériés ne sont pas encore en place,les instructions gardien ont été remises à jour. les documents sont à intégrer dans la ged.,4/8/17,en attente d'élements complémentaires,VP Auditeur 5
306,306.0,4,VP Fournisseur 401,Visi office 4,VP Auditeur 5,449,prise en compte et réactivité sur les réclamations monoprix : délais de réponse aux clients mdd établie en interne et respecté sur les cas monoprix ; pertinence du traitement et des actions mises en place après réception des réclamations monoprix,b,"* 1 réclamation monoprix enregistrée en 2016 (trop gras). absence en 2017 * 2016 : 30 à 50 réclamations par mois sur les lardons. 90% concernent la conservation (fuités, soudures) * nc. 2017 : amélioration de la situation avec encore environ 20 réclamations en mai 2017. le changement de doseuse et la modification de la procédure ""vision"" (de contrôle optique des soudures) constituent des actions efficaces * autres causes de réclamations en 2016 : ce métallique : 2 ce plastiques, joints",les réclamations sur les lardons ont diminué depuis les changements de matériel. action : révision des visions.,15/12/17,en attente d'élements complémentaires,VP Auditeur 5
307,307.0,4,VP Fournisseur 401,Visi office 4,VP Auditeur 5,449,"etalonnage légal annuel de la balance de contrôle des produits finis et contrôles intermédiaires internes au moins mensuels. dans le cas où les balances sont utilisées pour le contrôle individuel du dosage des produits, la balance doit être contrôlée quotidiennement.",b,* trieuses pondérales suivies en métrologie légale * contrôle quotidien des balances et des éjections * nc. absence de balance statique en métrologie légale pour contrôler les trieuses,création d'un dossier contrôle métrologique en juin 2017. former une personne à la réglementation des contrôles métrologiques : 2018. demande formation à l'adria pour 2018.,juin 2018,non approuvé,VP Auditeur 5
310,310.0,4,VP Fournisseur 401,Visi office 4,VP Auditeur 5,449,contrôle de poids des produits finis : pertinence des règles d'échantillonnage et conformité des résultats.,c,* trieuses pondérales sur chaque ligne (et remplissage par peseuse associative). ciblage de façon à garantir la moyenne et un maximum de 2% de produits sous -tu1 * trieuse avec un échelon de 1g (adapté) *nc. le système ne donne que la moyenne du lot. pas d'élément justificatif sur le nombre de défectueux de chaque lot * nc. absence de surveillance et de prise en compte de l'erreur de pesée sur le système dynamique et de l'incertitude sur les tares,les données sont existantes mais non reportées sur la fiche de contrôle. voir pour noter le nombre de défectueux par lot. voir avec le service automatisme pour récupérer les données sur pc.,31/12/17,en attente d'élements complémentaires,VP Auditeur 5
313,313.0,4,VP Fournisseur 401,Visi office 4,VP Auditeur 5,449,"présence d'une procédure de gestion des bris de verre documentée et connue par le personnel : la procédure doit prévoir à minima l'inspection ou si besoin le remplacement des tenues de travail, le nettoyage des chaussures, l'isolement de la zone de casse, l'enregistrement de l'incident.",c,* la procédure bris de verre prévoit la surveillance des installations. * nc. les règles ne sont pas définies pour les actions devant être conduites après constat de casse,"les règles sont définies dans le document ""maitrise du danger corps étranger"" pages 4 et 5. mais les règles ne sont pas connues de tous. faire un document d'une page pour affichage.",30/10/17,approuvé,VP Auditeur 5
314,314.0,4,VP Fournisseur 401,Visi office 4,VP Auditeur 5,449,présence de matériel de balayage spécifique pour les bris de verre,d,* nc. absence de matériel spécifique,"une pelle et un balai étaient prévus dans l'atelier maintenance amont mais ils ont disparu. acheter un ""kit verre"" pour mettre dans chaque atelier maintenance.",30/9/17,en attente d'élements complémentaires,VP Auditeur 5
315,315.0,4,VP Fournisseur 401,Visi office 4,VP Auditeur 5,449,retrait de la tenue de travail pendant les pauses (à minima le haut de la tenue ou protection par une sur-blouse),c,"* nc. bien que les règles soient définies en ce qui concerne le retrait des tenues (hautes) en pause, des personnes ont été constatées le matin en tablier de travail dans cette salle",mettre des affiches dans le salles de pause.,31/7/17,approuvé,VP Auditeur 5
316,316.0,4,VP Fournisseur 401,Visi office 4,VP Auditeur 5,449,"résultats du test de traçabilité réalisé (éléments amont et aval retracés, délai…)",d,"test : lardons fumés monoprix 07/07/2017 15:29 db 14271426 lot : db = lardons fumés monoprix / 142 = conditionnement 22/05 / 7 := ligne c7 / 142 = quantième fab. (idem) / 6 = 2017 * mp : poitrines friselva réceptionnées 20/04 :poitrine 20% ue : c * saumure la1 lot 19-3 (fab. 19/04, 3è fabrication). densité 1136 : conforme * barattage : da110b ( poitrine 20% non vpf ue) le 20/04. 5130 kg: c * etuvage : db118 (poitrine fumée monoprix) : le 28/04 (soit +8j). fnc pour durée excessive * tranchage-conditionnement : - nc. 800 kg (8 de pertes) le 22/05 (soit +24j) - poids moyen = 202g : c - conditionnement : 491 colis (3928 barquettes, soit 785 kg) : cohérent - conservation de tous les marquages : c - nc. teneur gazeuse (prpo 15b). non détectée. *expédition sur la plate forme logistique du groupe de 491 colis. * nc. livraison sur plateformes monoprix entre les 24/05 et 31/05) : 591 colis (soit 100 de plus sur le même lot). bilan t sans explication à ce jour",ecart de la plate forme lug. le lot précédent 12971296 a aussi un écart de 100 colis mais en moins. il y a eu un report d'un lot vers un autre lot. le lot suivant 14971496 est conforme.,-,en attente d'élements complémentaires,VP Auditeur 5
317,317.0,4,VP Fournisseur 401,Visi office 4,VP Auditeur 5,449,* les enregistrements,d,"* les enregistrements sont tous revus en fin de journée ou le lendemain par un responsable. * nc. pour le test de traçabilité, une nc sur la teneur gazeuse n'a pas été détectée (ni par l'opérateur, ni par le responsable) et le produit n'a pas été bloqué",l'opérateur et le conducteur de ligne ont été revus . les opérateurs ont été formés en 2016. faire une évaluation des opérateurs et enregistrer sur la fiche évaluation de la qualification au contrôle oxygène résiduel. //(ancienne action 26/07/2017 ) les opérateurs ont été formés en 2016. faire une évaluation des opérateurs et enregistrer sur la fiche évaluation de la qualification au contrôle oxygène résiduel.,30/09/17,approuvé,VP Auditeur 5
318,318.0,4,VP Fournisseur 401,Visi office 4,VP Auditeur 5,449,* spécifications poitrine,d,"* nc. spécification poitrine : comme défini dans le cahier des charges, le site applique une tolérance sur la température des poitrines réceptionnées jusqu'à 7°c. cette limite n'est pas pertinente lorsque les produits ont été abattus depuis plusieurs jours (cas général). cette limite n'a pas été validée * nc. le projet de cahier des charges fournisseur n'exclut pas les viandes issues de verrassons qui sont interdites pour les verrats. trace est silencieux sur le sujet * nc. aucune information qualité sur le site pour les fournisseurs ue",mettre le plan de contrôle reception à jour. mettre la fiche technique à jour (fait) et l'envoyer aux fournisseurs.,30/9/17,en attente d'élements complémentaires,VP Auditeur 5
269,269.0,0,VP Fournisseur 165,Visi office 4,VP Auditeur 6,449,les procédures de gestion de crise et de retrait/rappel prévoient de prévenir le sq monoprix sans délai dès lancement du retrait/rappel,c,"procédure gestion de crise version du 16/10 2016, elle prévoit l'envoi de l'information au client. la liste des numéros de téléphone peut être édité via le logiciel vif mais ce logiciel n'a pas été paramétré entièrement, les numéros des contacts ne sont pas à jour.",un travail d'intégration des contacts de crise sera effectué sous le logiciel vif,Janvier 2018,approuvé,VP Auditeur 6
270,270.0,0,VP Fournisseur 165,Visi office 4,VP Auditeur 6,449,prise en compte et réactivité sur les réclamations monoprix : délais de réponse aux clients mdd établie en interne et respecté sur les cas monoprix ; pertinence du traitement et des actions mises en place après réception des réclamations monoprix,b,"deux réclamations sont à noter pour les produits monoprix en 2017 : le 02/03/17 pour l'aspect d'un crottin de chavignol et le 08/03/17 pour l'aspect d'un selle sur cher. a chaque fois, le service qualité a répondu mais n'a pas utilisé le logiciel trace one pour les réponses effectuées (faites par mails).","en cas de réclamation sur le site trace one, nous ferons référence au mail envoyé à la responsable qualité (date + contact)",Immédiat,approuvé,VP Auditeur 6
260,260.0,12,VP Fournisseur 139,Visi office 4,VP Auditeur 6,449,respect du plan de contrôle sur les matières premières,b,"les résultats d'analyse des paramètres à rechercher par décade dans le lait de chèvre : cellules, immunoglobuline, lipolyse ne sont pas disponibles sur le site.",révision du cahier des charges pour retirer ces analyses qui ne présentent pas d'intérêt pour la fromagerie (seulement pour la collecte),Septembre 2017,approuvé,VP Auditeur 6
261,261.0,12,VP Fournisseur 139,Visi office 4,VP Auditeur 6,449,contrôle de poids des produits finis : pertinence des règles d'échantillonnage et conformité des résultats.,b,"sur le lot 17146 du 26/05/2017 audité, comprenant 495 pièces, il a été effectué 30 pesées (comme indiqué dans la procédure pour un lot inférieur à 500 pièces), mais il a été consigné que les contrôles de poids ont porté sur 50 pièces sur le document d'enregistrement.",rappel de consigne à l'encadrement de l'atelier emballage afin qu'ils soient plus rigoureux dans l'enregistrement des données oral et sous forme d'affichage au bureau,23/06/17,approuvé,VP Auditeur 6
